{
  "schema_version": 1,
  "protocol_version": 2,
  "generation_id": "gen-20260724-0007",
  "parent_generation_id": "gen-20260724-0006",
  "session_id": "sess-design-01",
  "state": "committed",
  "created_at": "2026-07-24T09:31:12Z",
  "created_by": "seelex-core",
  "resources": [
    {
      "path": "snapshot.json",
      "media_type": "application/json",
      "bytes": 1842,
      "sha256": "1c8bfe8f801d79745c4631d09fff36c82e05d86a4d55b57f1098b70ea5f0d9a7"
    },
    {
      "path": "events/events-0001.jsonl",
      "media_type": "application/x-ndjson",
      "bytes": 8192,
      "sha256": "9f86d081884c7d659a2feaa0c55ad015a3bf4f1b2b0b822cd15d6c15b0f00a08"
    }
  ],
  "content_sha256": "2c26b46b68ffc68ff99b453c1d30413413422d706483bfa0f98a5e886266e7ae",
  "metadata": {
    "reason": "checkpoint",
    "interrupted": false
  }
}
